{
  "id": "future-conditional",
  "title": "Future, conditional and past conditional",
  "priority": 2,
  "order": 3,
  "explanation": "Three ways to talk about \"not now\" (sheet):\n- **imparfait** for the past as background: je pensais (I was thinking / used to think), je dormais, il y avait\n- **futur simple** for a plain future: je penserai (I will think), je dormirai, il y aura\n- **futur proche**, aller + infinitive, for what is about to happen or is planned: je vais y penser, je vais dormir\n\nIn speech the futur proche does most of the work. Faire in all three: je faisais / je ferai / je vais faire. Note the irregular futur simple stems: je ferai, j'irai, je serai, j'aurai, je pourrai, je devrai, je saurai.\n\n**Conditional** softens: je voudrais (I'd like), ce serait mieux (that would be better), je devrais (I should), tu croirais ça ? (would you believe that?). It is the futur simple stem plus imparfait endings: je ferais, je serais, je devrais.\n\n**Past conditional** for what would have happened: j'aurais su (I would have known), ça aurait dû être (it should have been). It is the conditional of avoir or être plus the participle. With a si-clause: *si tu ne m'avais pas dit que tu étais au lit, je n'aurais pas su* (if you hadn't told me, I wouldn't have known). The si-clause takes the pluperfect (avais dit), never the conditional.",
  "items": [
    { "id": "fut-001", "unit": "future-conditional", "type": "flashcard", "fr": "Je pensais", "en": "I was thinking / I used to think", "note": "imparfait", "register": "neutral", "source": "sheet", "lesson_date": null, "check": false, "tts": true },
    { "id": "fut-002", "unit": "future-conditional", "type": "flashcard", "fr": "Je penserai", "en": "I will think", "note": "futur simple", "register": "neutral", "source": "sheet", "lesson_date": null, "check": false, "tts": true },
    { "id": "fut-003", "unit": "future-conditional", "type": "flashcard", "fr": "Je vais y penser", "en": "I'm going to think about it", "note": "futur proche; y stands for 'about it'", "register": "neutral", "source": "sheet", "lesson_date": null, "check": false, "tts": true },
    { "id": "fut-004", "unit": "future-conditional", "type": "flashcard", "fr": "Je dormirai", "en": "I will sleep", "register": "neutral", "source": "sheet", "lesson_date": null, "check": false, "tts": true },
    { "id": "fut-005", "unit": "future-conditional", "type": "flashcard", "fr": "Je vais dormir", "en": "I'm going to sleep", "register": "neutral", "source": "sheet", "lesson_date": null, "check": false, "tts": true },
    { "id": "fut-006", "unit": "future-conditional", "type": "flashcard", "fr": "Il y aura", "en": "There will be", "note": "future of il y a", "register": "neutral", "source": "sheet", "lesson_date": null, "check": false, "tts": true },
    { "id": "fut-007", "unit": "future-conditional", "type": "flashcard", "fr": "Je voudrais mieux communiquer", "en": "I'd like to communicate better", "note": "conditional of vouloir softens a wish", "register": "neutral", "source": "sheet", "lesson_date": null, "check": false, "tts": true },
    { "id": "fut-008", "unit": "future-conditional", "type": "flashcard", "fr": "Ce serait mieux qu'avant", "en": "That would be better than before", "register": "neutral", "source": "sheet", "lesson_date": null, "check": false, "tts": true },
    { "id": "fut-009", "unit": "future-conditional", "type": "flashcard", "fr": "Tu croirais ça ?", "en": "Would you believe that?", "register": "informal", "source": "sheet", "lesson_date": null, "check": false, "tts": true },
    { "id": "fut-010", "unit": "future-conditional", "type": "flashcard", "fr": "Je devrais", "en": "I should", "note": "conditional of devoir", "register": "neutral", "source": "sheet", "lesson_date": null, "check": false, "tts": true },
    { "id": "fut-011", "unit": "future-conditional", "type": "flashcard", "fr": "Ça aurait dû être plus simple", "en": "It should have been simpler", "note": "past conditional of devoir; the notes flag 'ça aurait dû être...' as one to revisit", "register": "neutral", "source": "lesson", "lesson_date": null, "check": false, "tts": true },
    { "id": "fut-012", "unit": "future-conditional", "type": "flashcard", "fr": "J'aurais su", "en": "I would have known", "register": "neutral", "source": "lesson", "lesson_date": "2026-09-18", "check": false, "tts": true },
    { "id": "fut-013", "unit": "future-conditional", "type": "flashcard", "fr": "Si tu ne m'avais pas dit que tu étais au lit, je n'aurais pas su", "en": "If you hadn't told me you were in bed, I wouldn't have known", "note": "reconstructed from a garbled transcript; pluperfect in the si-clause, past conditional in the main clause", "register": "neutral", "source": "lesson", "lesson_date": "2026-09-18", "check": true, "tts": true },
    { "id": "fut-014", "unit": "future-conditional", "type": "flashcard", "fr": "On va nager dans dix minutes", "en": "We're going swimming in ten minutes", "note": "the notes had 'je vais nager' for 'we'; je is I, so on va or nous allons", "register": "informal", "source": "lesson", "lesson_date": null, "check": true, "tts": true },
    { "id": "fut-015", "unit": "future-conditional", "type": "flashcard", "fr": "Je ferai", "en": "I will do / I will make", "note": "irregular stem fer-", "register": "neutral", "source": "sheet", "lesson_date": null, "check": false, "tts": true },
    { "id": "fut-016", "unit": "future-conditional", "type": "flashcard", "fr": "J'irai", "en": "I will go", "note": "aller's future stem is ir-", "register": "neutral", "source": "added", "lesson_date": null, "check": false, "tts": true },
    { "id": "fut-017", "unit": "future-conditional", "type": "flashcard", "fr": "Je serai", "en": "I will be", "register": "neutral", "source": "added", "lesson_date": null, "check": false, "tts": true },
    { "id": "fut-018", "unit": "future-conditional", "type": "flashcard", "fr": "J'aurai", "en": "I will have", "register": "neutral", "source": "added", "lesson_date": null, "check": false, "tts": true },
    { "id": "fut-019", "unit": "future-conditional", "type": "translate", "answers": ["Je vais t'appeler demain"], "fr": "Je vais t'appeler demain", "en": "I'm going to call you tomorrow", "note": "futur proche; t' before a vowel", "register": "informal", "source": "sheet", "lesson_date": null, "check": false, "tts": true },
    { "id": "fut-020", "unit": "future-conditional", "type": "translate", "answers": ["Ce serait mieux"], "fr": "Ce serait mieux", "en": "That would be better", "note": "conditional of être: serait", "register": "neutral", "source": "sheet", "lesson_date": null, "check": false, "tts": true },
    { "id": "fut-021", "unit": "future-conditional", "type": "translate", "answers": ["Je voudrais mieux expliquer ça", "J'aimerais mieux expliquer ça"], "fr": "Je voudrais mieux expliquer ça", "en": "I would like to explain this better", "note": "mieux goes before the infinitive", "register": "neutral", "source": "sheet", "lesson_date": null, "check": false, "tts": true },
    { "id": "fut-022", "unit": "future-conditional", "type": "translate", "answers": ["J'aurais su"], "fr": "J'aurais su", "en": "I would have known", "register": "neutral", "source": "lesson", "lesson_date": "2026-09-18", "check": false, "tts": true },
    { "id": "fut-023", "unit": "future-conditional", "type": "gapfill", "prompt_fr": "Avant, je ___ du sport tous les jours", "answers": ["faisais"], "fr": "Avant, je faisais du sport tous les jours", "en": "I used to do sport every day", "note": "faire in the imparfait", "register": "neutral", "source": "sheet", "lesson_date": null, "check": false, "tts": true },
    { "id": "fut-024", "unit": "future-conditional", "type": "gapfill", "prompt_fr": "Demain, je ___ les courses", "answers": ["ferai"], "fr": "Demain, je ferai les courses", "en": "Tomorrow I will do the shopping", "note": "faire in the futur simple", "register": "neutral", "source": "sheet", "lesson_date": null, "check": false, "tts": true },
    { "id": "fut-025", "unit": "future-conditional", "type": "gapfill", "prompt_fr": "Ce soir, je ___ faire la cuisine", "answers": ["vais"], "fr": "Ce soir, je vais faire la cuisine", "en": "Tonight I'm going to cook", "note": "faire in the futur proche", "register": "neutral", "source": "sheet", "lesson_date": null, "check": false, "tts": true },
    { "id": "fut-026", "unit": "future-conditional", "type": "gapfill", "prompt_fr": "Il y ___ du monde demain", "answers": ["aura"], "fr": "Il y aura du monde demain", "en": "There will be a lot of people tomorrow", "register": "neutral", "source": "added", "lesson_date": null, "check": false, "tts": true },
    { "id": "fut-027", "unit": "future-conditional", "type": "gapfill", "prompt_fr": "Je ___ mieux communiquer", "answers": ["voudrais"], "fr": "Je voudrais mieux communiquer", "en": "I'd like to communicate better", "register": "neutral", "source": "sheet", "lesson_date": null, "check": false, "tts": true },
    { "id": "fut-028", "unit": "future-conditional", "type": "gapfill", "prompt_fr": "Ce ___ mieux qu'avant", "answers": ["serait"], "fr": "Ce serait mieux qu'avant", "en": "That would be better than before", "register": "neutral", "source": "sheet", "lesson_date": null, "check": false, "tts": true },
    { "id": "fut-029", "unit": "future-conditional", "type": "gapfill", "prompt_fr": "Je ___ partir maintenant", "answers": ["devrais"], "fr": "Je devrais partir maintenant", "en": "I should leave now", "register": "neutral", "source": "added", "lesson_date": null, "check": false, "tts": true },
    { "id": "fut-030", "unit": "future-conditional", "type": "gapfill", "prompt_fr": "Si j'avais su, j'___ pris le train", "answers": ["aurais"], "fr": "Si j'avais su, j'aurais pris le train", "en": "If I had known, I would have taken the train", "note": "past conditional: aurais + participle", "register": "neutral", "source": "added", "lesson_date": null, "check": false, "tts": true },